

PROCEDURES

* Updating product price procedure

DECLARATION
This procedure updates the price of a product in the product table based on a percentage increase:
mysql> CREATE PROCEDURE UpdatePrice(IN pid INT, IN percentageIncrease DECIMAL(5,2))
    -> BEGIN
    ->     UPDATE product
    ->     SET price = price * (1 + percentageIncrease/100)
    ->     WHERE pid = pid;
    -> END 
Query OK, 0 rows affected (0.00 sec)

This stored procedure takes two parameters: pid specifies the ID of the product for which you want to update the price, and percentageIncrease indicates the percentage by which you want to increase the price.

CALLING THE PROCEDURE
mysql> CALL UpdatePrice(1, 10.0);
Query OK, 3 rows affected (0.00 sec)


VALIDATION
mysql> select * from product;
+-----+------+------+------+-----------+---------+-------+------------+
| pid | cid  | bid  | sid  | pname     | p_stock | price | added_date |
+-----+------+------+------+-----------+---------+-------+------------+
|   1 |    1 |    6 |    1 | Donuts    |      13 |     8 | 2023-11-12 |
|   2 |    1 |    5 |    1 | Bagel     |      11 |     4 | 2023-11-11 |
|   3 |    1 |    7 |    1 | Chocolate |      32 |     9 | 2023-10-11 |
|   4 |    2 |    7 |    1 | Aspirin   |       5 |     6 | 2023-11-12 |
|   5 |    2 |    5 |    1 | Dextrose  |      23 |     2 | 2023-04-11 |
|   6 |    3 |    6 |    1 | Beer      |      30 |     3 | 2023-11-05 |
|   7 |    3 |    6 |    2 | Beer      |      30 |     3 | 2023-11-05 |
|   8 |    3 |    6 |    3 | Chips     |      30 |     3 | 2023-11-05 |
+-----+------+------+------+-----------+---------+-------+------------+
8 rows in set (0.00 sec)



* Updating product quantity procedure

This procedure updates the quantity of a specific product by adding or subtracting a given quantity value.

DECLARATION
CREATE PROCEDURE UpdateProductStock(
    IN p_id INT,
    IN quantityChange INT
)
BEGIN
    UPDATE product
    SET p_stock = p_stock + quantityChange
    WHERE p_id = pid;
END

Query OK, 0 rows affected (0.00 sec)

In this procedure:

UpdateProductQuantity is the name of the procedure.
pid is the input parameter representing the product ID.
quantityChange is the input parameter representing the value by which the quantity should be updated.
The UPDATE statement updates the quantity column of the product table by adding or subtracting the quantityChange value.
The WHERE clause ensures that only the row corresponding to the specified pid is updated.

CALLING THE PROCEDURE
mysql> CALL UpdateProductStock(1, 5);
Query OK, 8 rows affected (0.01 sec)


VALIDATION
mysql> select * from product;
+-----+------+------+------+-----------+---------+-------+------------+
| pid | cid  | bid  | sid  | pname     | p_stock | price | added_date |
+-----+------+------+------+-----------+---------+-------+------------+
|   1 |    1 |    6 |    1 | Donuts    |      18 |     8 | 2023-11-12 |
|   2 |    1 |    5 |    1 | Bagel     |      16 |     4 | 2023-11-11 |
|   3 |    1 |    7 |    1 | Chocolate |      37 |     9 | 2023-10-11 |
|   4 |    2 |    7 |    1 | Aspirin   |      10 |     6 | 2023-11-12 |
|   5 |    2 |    5 |    1 | Dextrose  |      28 |     2 | 2023-04-11 |
|   6 |    3 |    6 |    1 | Beer      |      35 |     3 | 2023-11-05 |
|   7 |    3 |    6 |    2 | Beer      |      35 |     3 | 2023-11-05 |
|   8 |    3 |    6 |    3 | Chips     |      35 |     3 | 2023-11-05 |
+-----+------+------+------+-----------+---------+-------+------------+
8 rows in set (0.00 sec)


* Get product needed to restock procedure


This procedure retrieves the list of products that need to be restocked based on a specified threshold quantity.

DECLARATION

mysql> CREATE PROCEDURE GetProductsToRestock(
    ->     IN thresholdQuantity INT
    -> )
    -> BEGIN
    ->     SELECT pid, pname, p_stock
    ->     FROM product
    ->     WHERE p_stock <= thresholdQuantity;
    -> END
Query OK, 0 rows affected (0.00 sec)

In this procedure:

GetProductsToRestock is the name of the procedure.
thresholdQuantity is the input parameter representing the threshold quantity below which products are considered to be in need of restocking.
The SELECT statement retrieves the product ID, product name, and stock from the product table.
The WHERE clause filters the products to only include those with a stock less than or equal to the specified thresholdQuantity.

CALLING THE PROCEDURE AND VALIDATION

mysql> CALL GetProductsToRestock(10);
+-----+---------+---------+
| pid | pname   | p_stock |
+-----+---------+---------+
|   4 | Aspirin |      10 |
+-----+---------+---------+
1 row in set (0.00 sec)

Query OK, 0 rows affected (0.00 sec)
